{
  "$schema": "./theme.schema.json",
  "version": 1,
  "id": "tokyonight-day",
  "name": "Tokyo Night Day",
  "description": "Terminal palette from folke/tokyonight.nvim extras/kitty (MIT).",
  "colors": {
    "window": "#b4b5b9",
    "tab_bar": "#b4b5b9",
    "tab_text": "#6172b0",
    "tab_active": "#e1e2e7",
    "tab_active_text": "#3760bf",
    "tab_indicator": "#2e7de9",
    "rail_active": "#2e7de91a",
    "pane": "#e1e2e7",
    "pane_border": "#3760bf17",
    "pane_focus": "#2e7de980",
    "surface": "#f5f5fa",
    "text": "#3760bf",
    "muted": "#6172b0",
    "faint": "#6172b0",
    "accent": "#2e7de9",
    "accent_text": "#ffffff",
    "border": "#3760bf17",
    "focus": "#2e7de980",
    "selection": "#2e7de91a",
    "success": "#3f652a",
    "warning": "#755527",
    "danger": "#b92050",
    "info": "#2559b5",
    "foreground": "#3760bf",
    "background": "#e1e2e7",
    "cursor": "#3760bf",
    "cursor_text": "#e1e2e7",
    "selection_background": "#b7c1e3",
    "selection_foreground": "",
    "search_foreground": "#e1e2e7",
    "search_background": "#8c6c3e",
    "search_selected_background": "#2e7de9",
    "palette.0": "#b4b5b9",
    "palette.1": "#f52a65",
    "palette.2": "#587539",
    "palette.3": "#8c6c3e",
    "palette.4": "#2e7de9",
    "palette.5": "#9854f1",
    "palette.6": "#007197",
    "palette.7": "#6172b0",
    "palette.8": "#a1a6c5",
    "palette.9": "#ff4774",
    "palette.10": "#5c8524",
    "palette.11": "#a27629",
    "palette.12": "#358aff",
    "palette.13": "#a463ff",
    "palette.14": "#007ea8",
    "palette.15": "#3760bf"
  }
}
