{
  "$schema": "./theme.schema.json",
  "version": 1,
  "id": "ember-light",
  "name": "Ember Light",
  "colors": {
    "window": "#ece5de",
    "tab_bar": "#e7dfd7",
    "tab_text": "#5c4f45",
    "tab_active": "#fbf8f5",
    "tab_active_text": "#2b221b",
    "tab_indicator": "#a8540f",
    "rail_active": "#a8540f1a",
    "pane": "#fbf8f5",
    "pane_border": "#2b221b17",
    "pane_focus": "#a8540f80",
    "surface": "#ffffff",
    "text": "#2b221b",
    "muted": "#5c4f45",
    "faint": "#6f6055",
    "accent": "#a8540f",
    "accent_text": "#ffffff",
    "border": "#2b221b17",
    "focus": "#a8540f80",
    "selection": "#a8540f1a",
    "success": "#3d7a2b",
    "warning": "#86600f",
    "danger": "#b33e2e",
    "info": "#2d6298",
    "foreground": "#2b221b",
    "background": "#fbf8f5",
    "cursor": "#2b221b",
    "cursor_text": "#fbf8f5",
    "selection_background": "#f1dcc8",
    "selection_foreground": "",
    "search_foreground": "#2b221b",
    "search_background": "#f3d68d",
    "search_selected_background": "#f0b98a",
    "palette.0": "#4a3f37",
    "palette.1": "#b33e2e",
    "palette.2": "#3d7a2b",
    "palette.3": "#86600f",
    "palette.4": "#2d6298",
    "palette.5": "#8e4a94",
    "palette.6": "#22766a",
    "palette.7": "#ddd3c9",
    "palette.8": "#76675b",
    "palette.9": "#9e3424",
    "palette.10": "#336a23",
    "palette.11": "#71500b",
    "palette.12": "#255383",
    "palette.13": "#7a3e80",
    "palette.14": "#1b6359",
    "palette.15": "#fbf8f5"
  }
}
