{
  "$schema": "./theme.schema.json",
  "version": 1,
  "id": "tide-light",
  "name": "Tide Light",
  "colors": {
    "window": "#e7edf1",
    "tab_bar": "#e2e9ee",
    "tab_text": "#44535f",
    "tab_active": "#f8fafc",
    "tab_active_text": "#14212b",
    "tab_indicator": "#0b8170",
    "rail_active": "#0b81701a",
    "pane": "#f8fafc",
    "pane_border": "#14212b17",
    "pane_focus": "#0b817080",
    "surface": "#ffffff",
    "text": "#14212b",
    "muted": "#44535f",
    "faint": "#5a6976",
    "accent": "#0b8170",
    "accent_text": "#ffffff",
    "border": "#14212b17",
    "focus": "#0b817080",
    "selection": "#0b81701a",
    "success": "#2b7a37",
    "warning": "#7f5d0b",
    "danger": "#b53a3a",
    "info": "#1f61b0",
    "foreground": "#14212b",
    "background": "#f8fafc",
    "cursor": "#14212b",
    "cursor_text": "#f8fafc",
    "selection_background": "#d5ece8",
    "selection_foreground": "",
    "search_foreground": "#14212b",
    "search_background": "#f3d98c",
    "search_selected_background": "#9fdccf",
    "palette.0": "#3a4752",
    "palette.1": "#b53a3a",
    "palette.2": "#2b7a37",
    "palette.3": "#7f5d0b",
    "palette.4": "#1f61b0",
    "palette.5": "#7442b0",
    "palette.6": "#0f7082",
    "palette.7": "#d3dbe1",
    "palette.8": "#647380",
    "palette.9": "#a12f2f",
    "palette.10": "#22692e",
    "palette.11": "#6c4f08",
    "palette.12": "#1a5296",
    "palette.13": "#63379a",
    "palette.14": "#0b5f6f",
    "palette.15": "#f8fafc"
  }
}
