{
  "$schema": "./theme.schema.json",
  "version": 1,
  "id": "tokyonight-moon",
  "name": "Tokyo Night Moon",
  "description": "Terminal palette from folke/tokyonight.nvim extras/kitty (MIT).",
  "colors": {
    "window": "#1b1d2b",
    "tab_bar": "#1b1d2b",
    "tab_text": "#828bb8",
    "tab_active": "#222436",
    "tab_active_text": "#c8d3f5",
    "tab_indicator": "#82aaff",
    "rail_active": "#82aaff24",
    "pane": "#222436",
    "pane_border": "#c8d3f514",
    "pane_focus": "#82aaff80",
    "surface": "#2f334d",
    "text": "#c8d3f5",
    "muted": "#828bb8",
    "faint": "#828bb8",
    "accent": "#82aaff",
    "accent_text": "#222436",
    "border": "#c8d3f514",
    "focus": "#82aaff80",
    "selection": "#82aaff24",
    "success": "#c3e88d",
    "warning": "#ffc777",
    "danger": "#ff757f",
    "info": "#82aaff",
    "foreground": "#c8d3f5",
    "background": "#222436",
    "cursor": "#c8d3f5",
    "cursor_text": "#222436",
    "selection_background": "#2d3f76",
    "selection_foreground": "",
    "search_foreground": "#222436",
    "search_background": "#ffc777",
    "search_selected_background": "#82aaff",
    "palette.0": "#1b1d2b",
    "palette.1": "#ff757f",
    "palette.2": "#c3e88d",
    "palette.3": "#ffc777",
    "palette.4": "#82aaff",
    "palette.5": "#c099ff",
    "palette.6": "#86e1fc",
    "palette.7": "#828bb8",
    "palette.8": "#444a73",
    "palette.9": "#ff8d94",
    "palette.10": "#c7fb6d",
    "palette.11": "#ffd8ab",
    "palette.12": "#9ab8ff",
    "palette.13": "#caabff",
    "palette.14": "#b2ebff",
    "palette.15": "#c8d3f5"
  }
}
