{
  "$schema": "./theme.schema.json",
  "version": 1,
  "id": "studio-dark",
  "name": "Studio Dark",
  "colors": {
    "window": "#0c0c0e",
    "tab_bar": "#0c0c0e",
    "tab_text": "#9a9aa5",
    "tab_active": "#121215",
    "tab_active_text": "#ececf1",
    "tab_indicator": "#a194ff",
    "rail_active": "#a194ff24",
    "pane": "#121215",
    "pane_border": "#ececf114",
    "pane_focus": "#a194ff80",
    "surface": "#1b1b20",
    "text": "#ececf1",
    "muted": "#9a9aa5",
    "faint": "#83838d",
    "accent": "#a194ff",
    "accent_text": "#140e33",
    "border": "#ececf114",
    "focus": "#a194ff80",
    "selection": "#a194ff24",
    "success": "#7bd59c",
    "warning": "#e8c56b",
    "danger": "#ff7c87",
    "info": "#7fb6ff",
    "foreground": "#ececf1",
    "background": "#121215",
    "cursor": "#ececf1",
    "cursor_text": "#121215",
    "selection_background": "#2c2847",
    "selection_foreground": "",
    "search_foreground": "#121215",
    "search_background": "#e8c56b",
    "search_selected_background": "#a194ff",
    "palette.0": "#1b1b20",
    "palette.1": "#ff7c87",
    "palette.2": "#7bd59c",
    "palette.3": "#e8c56b",
    "palette.4": "#7fb6ff",
    "palette.5": "#e09bf0",
    "palette.6": "#6fd6d6",
    "palette.7": "#c9c9d1",
    "palette.8": "#6e6e79",
    "palette.9": "#ff9aa3",
    "palette.10": "#9be3b5",
    "palette.11": "#f2d68c",
    "palette.12": "#a3cbff",
    "palette.13": "#ebb7f5",
    "palette.14": "#95e3e3",
    "palette.15": "#f4f4f7"
  }
}
