{
  "$schema": "./theme.schema.json",
  "version": 1,
  "id": "tokyonight-storm",
  "name": "Tokyo Night Storm",
  "description": "Terminal palette from folke/tokyonight.nvim extras/kitty (MIT).",
  "colors": {
    "window": "#1d202f",
    "tab_bar": "#1d202f",
    "tab_text": "#a9b1d6",
    "tab_active": "#24283b",
    "tab_active_text": "#c0caf5",
    "tab_indicator": "#7aa2f7",
    "rail_active": "#7aa2f724",
    "pane": "#24283b",
    "pane_border": "#c0caf514",
    "pane_focus": "#7aa2f780",
    "surface": "#292e42",
    "text": "#c0caf5",
    "muted": "#a9b1d6",
    "faint": "#a9b1d6",
    "accent": "#7aa2f7",
    "accent_text": "#24283b",
    "border": "#c0caf514",
    "focus": "#7aa2f780",
    "selection": "#7aa2f724",
    "success": "#9ece6a",
    "warning": "#e0af68",
    "danger": "#f7768e",
    "info": "#7aa2f7",
    "foreground": "#c0caf5",
    "background": "#24283b",
    "cursor": "#c0caf5",
    "cursor_text": "#24283b",
    "selection_background": "#2e3c64",
    "selection_foreground": "",
    "search_foreground": "#24283b",
    "search_background": "#e0af68",
    "search_selected_background": "#7aa2f7",
    "palette.0": "#1d202f",
    "palette.1": "#f7768e",
    "palette.2": "#9ece6a",
    "palette.3": "#e0af68",
    "palette.4": "#7aa2f7",
    "palette.5": "#bb9af7",
    "palette.6": "#7dcfff",
    "palette.7": "#a9b1d6",
    "palette.8": "#414868",
    "palette.9": "#ff899d",
    "palette.10": "#9fe044",
    "palette.11": "#faba4a",
    "palette.12": "#8db0ff",
    "palette.13": "#c7a9ff",
    "palette.14": "#a4daff",
    "palette.15": "#c0caf5"
  }
}
