{
  "$schema": "./theme.schema.json",
  "version": 1,
  "id": "tide-dark",
  "name": "Tide Dark",
  "colors": {
    "window": "#0e1419",
    "tab_bar": "#111920",
    "tab_text": "#97a7b5",
    "tab_active": "#151e26",
    "tab_active_text": "#e0e8ef",
    "tab_indicator": "#4fcdb3",
    "rail_active": "#4fcdb324",
    "pane": "#151e26",
    "pane_border": "#e0e8ef14",
    "pane_focus": "#4fcdb380",
    "surface": "#1c2731",
    "text": "#e0e8ef",
    "muted": "#97a7b5",
    "faint": "#808f9b",
    "accent": "#4fcdb3",
    "accent_text": "#04201a",
    "border": "#e0e8ef14",
    "focus": "#4fcdb380",
    "selection": "#4fcdb324",
    "success": "#80d48c",
    "warning": "#e6c66c",
    "danger": "#f28282",
    "info": "#72b8ff",
    "foreground": "#e0e8ef",
    "background": "#151e26",
    "cursor": "#e0e8ef",
    "cursor_text": "#151e26",
    "selection_background": "#1d3b3d",
    "selection_foreground": "",
    "search_foreground": "#151e26",
    "search_background": "#e6c66c",
    "search_selected_background": "#4fcdb3",
    "palette.0": "#1c2731",
    "palette.1": "#f28282",
    "palette.2": "#80d48c",
    "palette.3": "#e6c66c",
    "palette.4": "#72b8ff",
    "palette.5": "#c49cf0",
    "palette.6": "#5fd0e0",
    "palette.7": "#c3ced8",
    "palette.8": "#6c7c89",
    "palette.9": "#ff9d9d",
    "palette.10": "#a0e2aa",
    "palette.11": "#f0d68f",
    "palette.12": "#9acdff",
    "palette.13": "#d6b8f6",
    "palette.14": "#8cdfeb",
    "palette.15": "#f2f6f9"
  }
}
