{
  "$schema": "./theme.schema.json",
  "version": 1,
  "id": "ember-dark",
  "name": "Ember Dark",
  "colors": {
    "window": "#171412",
    "tab_bar": "#1c1815",
    "tab_text": "#ab9d90",
    "tab_active": "#221d1a",
    "tab_active_text": "#eee6de",
    "tab_indicator": "#f0a35e",
    "rail_active": "#f0a35e24",
    "pane": "#221d1a",
    "pane_border": "#eee6de14",
    "pane_focus": "#f0a35e80",
    "surface": "#2c2623",
    "text": "#eee6de",
    "muted": "#ab9d90",
    "faint": "#998c80",
    "accent": "#f0a35e",
    "accent_text": "#1d1209",
    "border": "#eee6de14",
    "focus": "#f0a35e80",
    "selection": "#f0a35e24",
    "success": "#a6cf8a",
    "warning": "#e9c46a",
    "danger": "#ef7d6f",
    "info": "#93bce4",
    "foreground": "#eee6de",
    "background": "#221d1a",
    "cursor": "#eee6de",
    "cursor_text": "#221d1a",
    "selection_background": "#47331f",
    "selection_foreground": "",
    "search_foreground": "#221d1a",
    "search_background": "#e9c46a",
    "search_selected_background": "#f0a35e",
    "palette.0": "#2c2623",
    "palette.1": "#ef7d6f",
    "palette.2": "#a6cf8a",
    "palette.3": "#e9c46a",
    "palette.4": "#93bce4",
    "palette.5": "#d7a0db",
    "palette.6": "#8cd0c4",
    "palette.7": "#d6ccc2",
    "palette.8": "#7d7065",
    "palette.9": "#ff9a8d",
    "palette.10": "#bfe0a6",
    "palette.11": "#f3d58e",
    "palette.12": "#b3d1ee",
    "palette.13": "#e6bde9",
    "palette.14": "#abdfd6",
    "palette.15": "#f7f1eb"
  }
}
