{
  "$schema": "./theme.schema.json",
  "version": 1,
  "id": "studio-light",
  "name": "Studio Light",
  "colors": {
    "window": "#f5f5f7",
    "tab_bar": "#efeff2",
    "tab_text": "#52525c",
    "tab_active": "#ffffff",
    "tab_active_text": "#18181b",
    "tab_indicator": "#5b45e0",
    "rail_active": "#5b45e01a",
    "pane": "#ffffff",
    "pane_border": "#18181b17",
    "pane_focus": "#5b45e080",
    "surface": "#ffffff",
    "text": "#18181b",
    "muted": "#52525c",
    "faint": "#6b6b75",
    "accent": "#5b45e0",
    "accent_text": "#ffffff",
    "border": "#18181b17",
    "focus": "#5b45e080",
    "selection": "#5b45e01a",
    "success": "#1f7a3b",
    "warning": "#82600a",
    "danger": "#c02f3f",
    "info": "#1d5fc4",
    "foreground": "#18181b",
    "background": "#ffffff",
    "cursor": "#18181b",
    "cursor_text": "#ffffff",
    "selection_background": "#e4e0fb",
    "selection_foreground": "",
    "search_foreground": "#18181b",
    "search_background": "#f6dc8f",
    "search_selected_background": "#c4b9ff",
    "palette.0": "#3f3f46",
    "palette.1": "#c02f3f",
    "palette.2": "#1f7a3b",
    "palette.3": "#82600a",
    "palette.4": "#1d5fc4",
    "palette.5": "#8b3aa8",
    "palette.6": "#0e7676",
    "palette.7": "#d4d4da",
    "palette.8": "#6e6e78",
    "palette.9": "#b02435",
    "palette.10": "#16692f",
    "palette.11": "#6f5207",
    "palette.12": "#1a52a8",
    "palette.13": "#782f92",
    "palette.14": "#0b6464",
    "palette.15": "#f4f4f7"
  }
}
